{
  "schema_version": 1,
  "updated_at": "2026-07-21",
  "label": "数据运营",
  "page_views": 18742,
  "tools": [
    {
      "id": "chatgpt",
      "name": "ChatGPT",
      "icon": "🔥",
      "today_clicks": 1296,
      "updated_at": "2026-07-21",
      "note": "教程与推荐入口持续更新"
    },
    {
      "id": "cursor",
      "name": "Cursor",
      "icon": "⚡",
      "today_clicks": 988,
      "updated_at": "2026-07-21",
      "note": "Agent 工作流补充"
    },
    {
      "id": "deepseek",
      "name": "DeepSeek",
      "icon": "🚀",
      "today_clicks": 864,
      "updated_at": "2026-07-20",
      "note": "免费入门路径"
    },
    {
      "id": "claude",
      "name": "Claude",
      "icon": "✦",
      "today_clicks": 751,
      "updated_at": "2026-07-20",
      "note": "长文档与 Code 指南"
    },
    {
      "id": "gemini",
      "name": "Gemini",
      "icon": "◈",
      "today_clicks": 618,
      "updated_at": "2026-07-19",
      "note": "多模态场景"
    },
    {
      "id": "kimi",
      "name": "Kimi",
      "icon": "◐",
      "today_clicks": 512,
      "updated_at": "2026-07-19",
      "note": "长上下文阅读"
    }
  ]
}
